{
  "contract_version": "horoscope_calculation_response_v1",
  "service_code": "horoscope_basic_daily_natal_3_slots",
  "period": {
    "date": "2026-06-06",
    "timezone": "Europe/Paris"
  },
  "slots": [
    {
      "slot_code": "morning",
      "reference_local_time": "09:00",
      "sky_snapshot": {
        "reference_local_time": "09:00",
        "visible_objects": ["moon", "venus", "mars"],
        "zodiacal_reference_system": "tropical"
      },
      "moon_context": {
        "moon_sign": "virgo",
        "priority": "primary"
      },
      "transits_to_natal": [
        {
          "evidence_key": "slot:morning:moon:natal_house:6",
          "fact_type": "moon_natal_house_activation",
          "source": "fake_calculator_v1",
          "transiting_object": "moon",
          "natal_target": "natal_house_6",
          "aspect": null,
          "orb_deg": 0.8,
          "natal_house": 6
        }
      ],
      "current_sky_aspects": [
        {
          "transiting_object": "moon",
          "aspect": "conjunction",
          "target": "day_tone",
          "orb_deg": 1.0
        }
      ],
      "natal_house_activations": [
        {
          "house": 6,
          "activation": "routine"
        }
      ]
    },
    {
      "slot_code": "afternoon",
      "reference_local_time": "15:00",
      "sky_snapshot": {
        "reference_local_time": "15:00",
        "visible_objects": ["moon", "venus", "mars"],
        "zodiacal_reference_system": "tropical"
      },
      "moon_context": {
        "moon_sign": "libra",
        "priority": "primary"
      },
      "transits_to_natal": [
        {
          "evidence_key": "slot:afternoon:mars:square:natal_moon",
          "fact_type": "transit_to_natal",
          "source": "fake_calculator_v1",
          "transiting_object": "mars",
          "natal_target": "natal_moon",
          "aspect": "square",
          "orb_deg": 2.2,
          "natal_house": null
        }
      ],
      "current_sky_aspects": [
        {
          "transiting_object": "moon",
          "aspect": "conjunction",
          "target": "day_tone",
          "orb_deg": 1.0
        }
      ],
      "natal_house_activations": [
        {
          "house": 6,
          "activation": "routine"
        }
      ]
    },
    {
      "slot_code": "evening",
      "reference_local_time": "21:00",
      "sky_snapshot": {
        "reference_local_time": "21:00",
        "visible_objects": ["moon", "venus", "mars"],
        "zodiacal_reference_system": "tropical"
      },
      "moon_context": {
        "moon_sign": "libra",
        "priority": "primary"
      },
      "transits_to_natal": [
        {
          "evidence_key": "slot:evening:venus:trine:natal_mercury",
          "fact_type": "transit_to_natal",
          "source": "fake_calculator_v1",
          "transiting_object": "venus",
          "natal_target": "natal_mercury",
          "aspect": "trine",
          "orb_deg": 1.4,
          "natal_house": null
        }
      ],
      "current_sky_aspects": [
        {
          "transiting_object": "moon",
          "aspect": "conjunction",
          "target": "day_tone",
          "orb_deg": 1.0
        }
      ],
      "natal_house_activations": [
        {
          "house": 6,
          "activation": "routine"
        }
      ]
    }
  ],
  "calculation_warnings": [],
  "evidence_keys": [
    "slot:morning:moon:natal_house:6",
    "slot:afternoon:mars:square:natal_moon",
    "slot:evening:venus:trine:natal_mercury"
  ]
}
